{
  "schema_kind": "odd_world_model.context_invocation_record",
  "schema_version": "v1",
  "invocation_ref": "context-invocation://odd_world_model/sandbox/trade_source_model/v1",
  "context_basis": {
    "ref": "context-basis://odd_world_model/sandbox/trade_source_model/v1",
    "digest": "sha256:62559681c949f3ad6642778725e36196e742d3c94fab175205b4db3fc4e28460"
  },
  "context_projection": {
    "ref": "context-projection://odd_world_model/sandbox/trade_source_model/v1",
    "digest": "sha256:a605f30d6947a8d240827bf909c5871e2127ce1400d007ad4a561d9f75789acf"
  },
  "model_identity": "model-capability://odd_world_model/reference-sandbox-interpreter/v1",
  "model_role": "F_P",
  "invoked_at": "2026-07-12T14:28:27.645Z",
  "completed_at": "2026-07-12T14:28:27.645Z",
  "output_digest": "sha256:9b82d736ac1f3dee891732741bf44c9a8c96fe466d6b34e0d9955479fbe899f5",
  "output_proposal_ref": "proposal://odd_world_model/sandbox/trade_source_model/interpretation/v1",
  "abg_event_refs": [
    "runtime-event:2026-07-12T14:28:28.537Z:617:09c13013-5a85-437a-ba4b-5c37f8bec7c6",
    "runtime-event:2026-07-12T14:28:28.537Z:618:d8e9cca1-d119-4a9b-a1ce-a7caf5c6bcb2",
    "runtime-event:2026-07-12T14:28:28.539Z:634:3d885116-8333-48b5-ad6c-c3c2bc808550",
    "runtime-event:2026-07-12T14:28:28.539Z:637:c0008fcd-5ec4-4765-a06c-de30b9b9405b",
    "runtime-event:2026-07-12T14:28:28.539Z:640:5110cd47-bbe2-4d35-80b1-913a3dc4a02b",
    "runtime-event:2026-07-12T14:28:28.544Z:670:9a71386f-1b95-4b3f-9ea4-8b60e7c00eaf",
    "runtime-event:2026-07-12T14:28:28.544Z:671:9418e20f-84d4-40d8-8991-09a172abe4e1"
  ],
  "admission": {
    "ref": "admission-witness://odd_world_model/sandbox/trade_source_model-interpretation-v1",
    "digest": "sha256:cb03fb33586ec8062a1de4e44a5c15f8f168ec0a01e7a169b61c60a00aed4151"
  },
  "freshness_catalog": {
    "ref": "context-dependency-catalog://odd_world_model/sandbox/trade_source_model/v1",
    "digest": "sha256:458c2cef4e1a27ddd066c21990cc091859837228254bbbb8a33cb68e5f3c4e2e"
  },
  "admission_status": "admitted",
  "freshness_status": "fresh",
  "invocation_digest": "sha256:6fab795fa1f72598b8eb20771a8de84a8173d0a459bd3bce9c07c8560f6eb8ff"
}
